rank,figure_file,why_keep_publicly
1,phase2_03_genre_mix_by_type.png,Best high-level view of how Movies and TV Shows play different portfolio roles.
2,phase2_04_concentration_curves.png,Strongest single view of concentration versus diversification across genres and countries.
3,phase2_06_release_to_add_lag_by_type.png,Clear explanation of freshness versus legacy depth in the catalog.
4,phase3_01_titles_added_profile.png,Best chart for catalog growth and timing of supply additions.
5,phase3_05_geographic_diversification_over_time.png,Best chart for the localization-versus-globalization story.
6,phase3_07_cluster_profile_heatmap.png,Strongest advanced output because it compresses the catalog into business-readable segments.
7,phase3_08_cast_ecosystem_network.png,Adds differentiated depth without drifting into academic network analysis.
