cluster_id,cluster_label,business_definition,title_count,cluster_share,movie_share,tv_share,mature_share,kids_share,median_release_year,median_lag,multi_country_share,recent_share,median_country_count,median_genre_count
0,Recent International Movie Core,Recent movie-heavy cluster with quick catalog entry and strong international genre coverage.,1793,0.28761629772216873,1.0,0.0,0.47071946458449526,0.016731734523145567,2017.0,1.0,0.1305075292805354,1.0,1.0,3.0
1,Legacy Mainstream Library,"Older, longer-lag library titles anchored in mainstream movie genres with some spillover TV inventory.",1528,0.24510747513634906,0.7696335078534031,0.23036649214659685,0.3089005235602094,0.05039267015706806,2010.0,8.0,0.12041884816753927,0.0,1.0,2.0
2,Recent International TV Series,"Very recent TV-first cluster centered on international drama, crime, and serialized formats.",1236,0.19826756496631376,0.0,1.0,0.42961165048543687,0.07524271844660194,2018.0,0.0,0.06634304207119741,1.0,1.0,3.0
3,Deep Library Classics,Small deep-library pocket dominated by classic and long-lag film inventory.,275,0.04411292909849214,0.9127272727272727,0.08727272727272728,0.26545454545454544,0.014545454545454545,1984.0,34.0,0.11636363636363636,0.0,1.0,3.0
4,Multi-country Co-productions,Cross-border co-production cluster with the broadest country footprint per title.,306,0.04908565928777671,0.8006535947712419,0.19934640522875818,0.41830065359477125,0.0915032679738562,2015.5,2.0,1.0,0.6568627450980392,3.0,2.0
5,Current Factual and Family Programming,"Recent factual, stand-up, and family-oriented programming cluster with strong US skew.",1096,0.1758100737888996,0.7299270072992701,0.27007299270072993,0.44616788321167883,0.15967153284671534,2017.0,0.0,0.07481751824817519,0.9945255474452555,1.0,1.0
