cluster_id,cluster_label,business_definition,title_count,cluster_share,movie_share,tv_share,mature_share,kids_share,median_release_year,median_lag,multi_country_share,recent_share,median_country_count,median_genre_count
0,Recent International Movie Core,Recent movie-heavy cluster with quick catalog entry and strong international genre coverage.,412,0.04678096968320654,0.9296116504854369,0.0703883495145631,0.3106796116504854,0.009708737864077669,1986.0,33.0,0.13349514563106796,0.0,1.0,2.5
1,Legacy Mainstream Library,"Older, longer-lag library titles anchored in mainstream movie genres with some spillover TV inventory.",1630,0.1850800499602589,0.7515337423312883,0.24846625766871167,0.46748466257668714,0.17423312883435582,2018.0,0.0,0.06687116564417178,0.9969325153374233,1.0,1.0
2,Recent International TV Series,"Very recent TV-first cluster centered on international drama, crime, and serialized formats.",1710,0.19416373339389123,0.0,1.0,0.5228070175438596,0.07543859649122807,2019.0,0.0,0.07017543859649122,0.9988304093567252,1.0,3.0
3,Deep Library Classics,Small deep-library pocket dominated by classic and long-lag film inventory.,2171,0.24650845918019756,0.787655458314141,0.21234454168585906,0.33993551358820817,0.06771073238139107,2011.0,8.0,0.1294334408106863,0.0,1.0,2.0
4,Multi-country Co-productions,Cross-border co-production cluster with the broadest country footprint per title.,435,0.049392528670375836,0.8367816091954023,0.1632183908045977,0.4850574712643678,0.08735632183908046,2016.0,3.0,1.0,0.5724137931034483,3.0,2.0
5,Current Factual and Family Programming,"Recent factual, stand-up, and family-oriented programming cluster with strong US skew.",2449,0.27807425911206995,1.0,0.0,0.5210289914250714,0.01837484687627603,2018.0,1.0,0.12862392813393222,1.0,1.0,3.0
